{"kind":"RubricJudgeResult","schema_version":"1.0.0","evaluation_id":"eval-run01-a-r2","run_id":"run01-a","case_id":"aging-bidirectional-development-v1","rubric_version":"aging-bidirectional-rubric-v1","catalog_sha256":"ab175e1ebbf6c399e84808ba16f094b4b141776edd23ece79c829d1dfd73efdd","stage":1,"expected_units":{"P1":{"included_work":["work-1"],"central_claim":["claim-1"],"stage_summary":["stage-1-summary"]},"P2":{"literature_set":["literature-set-1"]},"P3":{"stage1_run":["stage1-run-1"]}},"subject_artifact":{"path":"examples/subject-stage1.synthetic.json","sha256":"ade8fa2cfaf2c92dc881fc385c71b29fc75d57e75704d1e3b56b7799ec659376"},"judge":{"role":"auto-r2","model":"gpt-5.6-sol","reasoning":"high","config_id":"aging-r2-v1","prompt_sha256":"eeeeeeeeeeeeeeeeeeeeeeeeeeeeeeeeeeeeeeeeeeeeeeeeeeeeeeeeeeeeeeee","evaluation_config_sha256":"8888888888888888888888888888888888888888888888888888888888888888","execution_context_id":"judge-context-2","condition_blinded":true},"study_mode":"method-development","metric_results":[{"metric_id":"P1","unit_type":"included_work","unit_id":"work-1","score":2,"hard_fact_status":"pass","hard_measures":{"synthetic_check":"pass"},"criterion_results":[{"criterion_id":"P1.IDENTITY","outcome":"pass","evidence_ids":["evidence-p1.identity"],"reason":"Synthetic evidence satisfies this criterion."},{"criterion_id":"P1.IDENTIFIER","outcome":"pass","evidence_ids":["evidence-p1.identifier"],"reason":"Synthetic evidence satisfies this criterion."},{"criterion_id":"P1.CLAIM_SUPPORT","outcome":"pass","evidence_ids":["evidence-p1.claim_support"],"reason":"Synthetic evidence satisfies this criterion."},{"criterion_id":"P1.LOCATOR","outcome":"pass","evidence_ids":["evidence-p1.locator"],"reason":"Synthetic evidence satisfies this criterion."},{"criterion_id":"P1.EVIDENCE_LEVEL","outcome":"pass","evidence_ids":["evidence-p1.evidence_level"],"reason":"Synthetic evidence satisfies this criterion."},{"criterion_id":"P1.CENTRAL_MISMATCH","outcome":"pass","evidence_ids":["evidence-p1.central_mismatch"],"reason":"Synthetic evidence satisfies this criterion."}],"missing_evidence":[],"major_error_ids":[],"reason":"All applicable frozen criteria pass.","confidence":"high","needs_human_review":false},{"metric_id":"P1","unit_type":"central_claim","unit_id":"claim-1","score":2,"hard_fact_status":"pass","hard_measures":{"synthetic_check":"pass"},"criterion_results":[{"criterion_id":"P1.IDENTITY","outcome":"pass","evidence_ids":["evidence-p1.identity"],"reason":"Synthetic evidence satisfies this criterion."},{"criterion_id":"P1.IDENTIFIER","outcome":"pass","evidence_ids":["evidence-p1.identifier"],"reason":"Synthetic evidence satisfies this criterion."},{"criterion_id":"P1.CLAIM_SUPPORT","outcome":"pass","evidence_ids":["evidence-p1.claim_support"],"reason":"Synthetic evidence satisfies this criterion."},{"criterion_id":"P1.LOCATOR","outcome":"pass","evidence_ids":["evidence-p1.locator"],"reason":"Synthetic evidence satisfies this criterion."},{"criterion_id":"P1.EVIDENCE_LEVEL","outcome":"pass","evidence_ids":["evidence-p1.evidence_level"],"reason":"Synthetic evidence satisfies this criterion."},{"criterion_id":"P1.CENTRAL_MISMATCH","outcome":"pass","evidence_ids":["evidence-p1.central_mismatch"],"reason":"Synthetic evidence satisfies this criterion."}],"missing_evidence":[],"major_error_ids":[],"reason":"All applicable frozen criteria pass.","confidence":"high","needs_human_review":false},{"metric_id":"P1","unit_type":"stage_summary","unit_id":"stage-1-summary","score":2,"hard_fact_status":"pass","hard_measures":{"synthetic_check":"pass"},"criterion_results":[{"criterion_id":"P1.IDENTITY","outcome":"pass","evidence_ids":["evidence-p1.identity"],"reason":"Synthetic evidence satisfies this criterion."},{"criterion_id":"P1.IDENTIFIER","outcome":"pass","evidence_ids":["evidence-p1.identifier"],"reason":"Synthetic evidence satisfies this criterion."},{"criterion_id":"P1.CLAIM_SUPPORT","outcome":"pass","evidence_ids":["evidence-p1.claim_support"],"reason":"Synthetic evidence satisfies this criterion."},{"criterion_id":"P1.LOCATOR","outcome":"pass","evidence_ids":["evidence-p1.locator"],"reason":"Synthetic evidence satisfies this criterion."},{"criterion_id":"P1.EVIDENCE_LEVEL","outcome":"pass","evidence_ids":["evidence-p1.evidence_level"],"reason":"Synthetic evidence satisfies this criterion."},{"criterion_id":"P1.CENTRAL_MISMATCH","outcome":"pass","evidence_ids":["evidence-p1.central_mismatch"],"reason":"Synthetic evidence satisfies this criterion."}],"missing_evidence":[],"major_error_ids":[],"reason":"All applicable frozen criteria pass.","confidence":"high","needs_human_review":false},{"metric_id":"P2","unit_type":"literature_set","unit_id":"literature-set-1","score":2,"hard_fact_status":"pass","hard_measures":{"synthetic_check":"pass"},"criterion_results":[{"criterion_id":"P2.CLUSTERS","outcome":"pass","evidence_ids":["evidence-p2.clusters"],"reason":"Synthetic evidence satisfies this criterion."},{"criterion_id":"P2.CORE","outcome":"pass","evidence_ids":["evidence-p2.core"],"reason":"Synthetic evidence satisfies this criterion."},{"criterion_id":"P2.MUST_HAVE","outcome":"pass","evidence_ids":["evidence-p2.must_have"],"reason":"Synthetic evidence satisfies this criterion."},{"criterion_id":"P2.RECENT","outcome":"pass","evidence_ids":["evidence-p2.recent"],"reason":"Synthetic evidence satisfies this criterion."},{"criterion_id":"P2.CLOSEST_WORK","outcome":"pass","evidence_ids":["evidence-p2.closest_work"],"reason":"Synthetic evidence satisfies this criterion."},{"criterion_id":"P2.SUBSTITUTE","outcome":"pass","evidence_ids":["evidence-p2.substitute"],"reason":"Synthetic evidence satisfies this criterion."}],"missing_evidence":[],"major_error_ids":[],"reason":"All applicable frozen criteria pass.","confidence":"high","needs_human_review":false},{"metric_id":"P3","unit_type":"stage1_run","unit_id":"stage1-run-1","score":2,"hard_fact_status":"pass","hard_measures":{"synthetic_check":"pass"},"criterion_results":[{"criterion_id":"P3.SEARCH_TRACE","outcome":"pass","evidence_ids":["evidence-p3.search_trace"],"reason":"Synthetic evidence satisfies this criterion."},{"criterion_id":"P3.DECISION_TRACE","outcome":"pass","evidence_ids":["evidence-p3.decision_trace"],"reason":"Synthetic evidence satisfies this criterion."},{"criterion_id":"P3.VERSION_DATE","outcome":"pass","evidence_ids":["evidence-p3.version_date"],"reason":"Synthetic evidence satisfies this criterion."},{"criterion_id":"P3.CLAIM_TRACE","outcome":"pass","evidence_ids":["evidence-p3.claim_trace"],"reason":"Synthetic evidence satisfies this criterion."},{"criterion_id":"P3.FAILURE_STATE","outcome":"pass","evidence_ids":["evidence-p3.failure_state"],"reason":"Synthetic evidence satisfies this criterion."},{"criterion_id":"P3.STOP_EVIDENCE","outcome":"pass","evidence_ids":["evidence-p3.stop_evidence"],"reason":"Synthetic evidence satisfies this criterion."}],"missing_evidence":[],"major_error_ids":[],"reason":"All applicable frozen criteria pass.","confidence":"high","needs_human_review":false}],"audit_trigger_ids":[],"requires_human_audit":false,"created_at":"2026-09-17T16:00:00-04:00"}
